{
  "$schema": "https://json-schema.org/draft/2020-12/schema",
  "$id": "monitor-artifact.schema.json",
  "title": "Monitor Artifact",
  "description": "Стандартний вихідний артефакт будь-якого агента-монітора (monitor-edo, monitor-rada-bills, monitor-kmu, monitor-nbu). Зберігається у runs/{agent_id}/{run_id}.json.",
  "type": "object",
  "required": ["agent_id", "agent_version", "run_id", "period", "source_url", "items", "stats"],
  "additionalProperties": false,
  "properties": {
    "agent_id": {
      "type": "string",
      "enum": ["monitor-edo", "monitor-rada-bills", "monitor-kmu", "monitor-nbu"],
      "description": "Ідентифікатор агента-монітора"
    },
    "agent_version": {
      "type": "string",
      "pattern": "^\\d+\\.\\d+$",
      "description": "Версія агента, наприклад '1.0'"
    },
    "run_id": {
      "type": "string",
      "pattern": "^\\d{4}-\\d{2}-\\d{2}T\\d{2}-\\d{2}-\\d{2}Z$",
      "description": "Унікальний ідентифікатор запуску. Формат: YYYY-MM-DDTHH-MM-SSZ (дефіси замість двокрапок у часі)"
    },
    "period": {
      "type": "object",
      "required": ["from", "to"],
      "additionalProperties": false,
      "description": "Розрахунковий період — від попереднього запуску цього агента до поточного",
      "properties": {
        "from": {
          "type": "string",
          "format": "date-time",
          "description": "Початок розрахункового періоду (ISO 8601 UTC)"
        },
        "to": {
          "type": "string",
          "format": "date-time",
          "description": "Кінець розрахункового періоду (ISO 8601 UTC)"
        }
      }
    },
    "source_url": {
      "type": "string",
      "description": "URL джерела моніторингу. Для monitor-edo — може бути кілька через ' / '"
    },
    "items": {
      "type": "array",
      "description": "Нові документи знайдені за розрахунковий період (після дедуплікації та фільтрації релевантності)",
      "items": {
        "$ref": "#/$defs/MonitorItem"
      }
    },
    "stats": {
      "type": "object",
      "required": ["items_found", "duplicates_filtered", "errors"],
      "additionalProperties": false,
      "description": "Статистика запуску",
      "properties": {
        "items_found": {
          "type": "integer",
          "minimum": 0,
          "description": "Кількість нових документів у items[]"
        },
        "duplicates_filtered": {
          "type": "integer",
          "minimum": 0,
          "description": "Кількість URL відфільтрованих як дублікати (вже були в seen_urls)"
        },
        "errors": {
          "type": "array",
          "description": "Список помилок під час запуску, наприклад 'source_unavailable: itd.rada.gov.ua'",
          "items": {
            "type": "string"
          }
        }
      }
    }
  },
  "$defs": {
    "MonitorItem": {
      "type": "object",
      "required": ["title", "url", "raw_status"],
      "additionalProperties": false,
      "description": "Один знайдений документ (НПА або законопроект)",
      "properties": {
        "title": {
          "type": "string",
          "description": "Повна назва документа"
        },
        "number": {
          "type": "string",
          "description": "Номер акта або реєстраційний номер законопроекту. Може бути відсутнім якщо джерело не надає."
        },
        "date_published": {
          "type": "string",
          "format": "date",
          "description": "Дата публікації або реєстрації (YYYY-MM-DD)"
        },
        "url": {
          "type": "string",
          "format": "uri",
          "description": "Пряме посилання на офіційний текст документа"
        },
        "raw_status": {
          "type": "string",
          "enum": ["found"],
          "description": "Статус знайденого документа на рівні монітора. Завжди 'found' — детальна валідація виконується Validator."
        }
      }
    }
  }
}
