{
  "agent_id": "monitor-nbu",
  "agent_version": "1.0",
  "run_id": "2026-05-07T06-01-00Z",
  "period": {
    "from": "2026-05-06T14:00:00Z",
    "to": "2026-05-07T05:00:00Z"
  },
  "source_url": "https://bank.gov.ua/ua/legislation",
  "items": [],
  "stats": {
    "items_found": 0,
    "duplicates_filtered": 1,
    "errors": []
  }
}
