{
  "agent_id": "monitor-kmu",
  "agent_version": "1.0",
  "run_id": "2026-05-07T11-18-21Z",
  "period": {
    "from": "2026-05-07T10:46:10Z",
    "to": "2026-05-07T11:18:21Z"
  },
  "source_url": "https://www.kmu.gov.ua/npasearch",
  "items": [],
  "stats": {
    "items_found": 0,
    "duplicates_filtered": 0,
    "errors": []
  }
}
