{
  "agent_id": "monitor-kmu",
  "agent_version": "1.0",
  "run_id": "2026-05-07T06-00-30Z",
  "period": {
    "from": "2026-05-06T14:00:00Z",
    "to": "2026-05-07T05:00:00Z"
  },
  "source_url": "https://www.kmu.gov.ua/npasearch",
  "items": [
    {
      "title": "Постанова КМУ від 06.05.2026 № 534 «Про затвердження Порядку функціонування системи міжвідомчого електронного документообігу органів виконавчої влади»",
      "number": "534",
      "date_published": "2026-05-06",
      "url": "https://www.kmu.gov.ua/npas/pro-zatverdzhennya-poryadku-534-06052026",
      "raw_status": "found"
    },
    {
      "title": "Розпорядження КМУ від 06.05.2026 № 412-р «Про схвалення Концепції розвитку системи електронних довірчих послуг в Україні на 2026-2030 роки»",
      "number": "412-р",
      "date_published": "2026-05-06",
      "url": "https://www.kmu.gov.ua/npas/pro-skhvalennya-kontseptsiyi-412-r-06052026",
      "raw_status": "found"
    },
    {
      "title": "Постанова КМУ від 05.05.2026 № 521 «Про внесення змін до Порядку застосування кваліфікованих електронних підписів у системах електронного урядування»",
      "number": "521",
      "date_published": "2026-05-05",
      "url": "https://www.kmu.gov.ua/npas/pro-vnesennya-zmin-521-05052026",
      "raw_status": "found"
    }
  ],
  "stats": {
    "items_found": 3,
    "duplicates_filtered": 8,
    "errors": []
  }
}
